{"catalog_version":"0.1","entries":[{"entry_id":"synthetic.damage.001","envelope_path":"knowledge/fixtures/static_fallback_template_synthetic_0_1.json","envelope_sha256":"0aa67412ee12876998a9ae2bb49c5698463aaac332a2c17ce6169dcf9125d8aa","index":{"build_max":120999,"build_min":120000,"class_id":1,"content_contexts":["synthetic_single_target"],"interface_max":120999,"interface_min":120000,"level_max":80,"level_min":80,"race_ids":null,"role":"damage","specialization_id":71,"wow_product":"retail"},"invalidation_reasons":[],"lifecycle_state":"pending_review","review":{"decided_at":null,"decision_id":null,"notes":["synthetic_fixture_only"],"prior_approval_decision_id":null,"reviewer_id":null,"transition_reason":null},"role_policy":{"dynamic_safety_satisfied":false,"policy_id":"damage.safety_first.0_1"},"source_coverage_complete":false,"supersedes_entry_ids":[]}],"identity":{"catalog_id":"dpslab.synthetic.static.catalog","channel":"stable","content_version":"0.1.0","created_at":"2026-07-31T00:00:00Z"},"integrity":{"catalog_sha256":"decef73f2d25d82a174e27c50d9584be3f11037328ab660a6fe6f04e189d70e9","hash_algorithm":"sha256"}}
